{"arch":"x86_64","arguments":[],"engine":"godot","entrypoint":"bin/ゲーム.exe","files":[{"chunks":[{"offset":0,"sha256":"bbbbbbbbbbbbbbbbbbbbbbbbbbbbbbbbbbbbbbbbbbbbbbbbbbbbbbbbbbbbbbbb","size":4,"url":"https://downloads.koto-thing.com/blobs/sha256/value"}],"executable":true,"path":"bin/ゲーム.exe","sha256":"aaaaaaaaaaaaaaaaaaaaaaaaaaaaaaaaaaaaaaaaaaaaaaaaaaaaaaaaaaaaaaaa","size":4}],"gameId":"sample-game","minimumLauncherVersion":"1.0.0","platform":"windows","publishedAt":"2026-08-10T00:00:00Z","saveDirectoryName":"sample-game","schemaVersion":1,"signature":"A8pe8cx36xl5o7dQ0LUWCuPlAXnehJ6jarxPkg5vzmO5ujEghmLB3M+kn5BSjlYtGvlNIAWJRPhNs+sXC96KAw==","totalSize":4,"version":"1.2.3","workingDirectory":"bin"}
